{
  "schemaVersion": "1.0.0",
  "catalogSchemaVersion": "2.0.0",
  "catalogCheckedThrough": "2026-10-13",
  "vendors": [
    {
      "id": "vendor-anthropic",
      "name": "Anthropic",
      "models": [
        {
          "id": "model-discovered-58ae42fa2da27922842c",
          "name": "Claude Haiku 4.5",
          "apiModelId": "claude-haiku-4-5-20251001"
        },
        {
          "id": "model-discovered-6ecba795d54626cad53a",
          "name": "Claude Haiku 5.5",
          "apiModelId": "claude-haiku-5-5"
        },
        {
          "id": "model-claude-opus-5",
          "name": "Claude Opus 5",
          "apiModelId": "claude-opus-5"
        },
        {
          "id": "model-discovered-d012f907c072513f5255",
          "name": "Claude Opus 5.5",
          "apiModelId": "claude-opus-5-5"
        },
        {
          "id": "model-discovered-473d2baac36d5968b9d0",
          "name": "Claude Sonnet 5",
          "apiModelId": "claude-sonnet-5"
        },
        {
          "id": "model-discovered-96d8ab554f3c88811afc",
          "name": "Claude Sonnet 5.5",
          "apiModelId": "claude-sonnet-5-5"
        },
        {
          "id": "model-fable-5",
          "name": "Fable 5",
          "apiModelId": null
        },
        {
          "id": "model-fable-5-1",
          "name": "Fable 5.1",
          "apiModelId": "claude-fable-5-1"
        }
      ]
    },
    {
      "id": "vendor-cursor",
      "name": "Cursor",
      "models": []
    },
    {
      "id": "vendor-google",
      "name": "Google",
      "models": [
        {
          "id": "model-discovered-176fb23288af2af4493e",
          "name": "Computer Use",
          "apiModelId": "gemini-2.5-computer-use-preview-10-2025"
        },
        {
          "id": "model-discovered-29705db1c67f0fadf65e",
          "name": "Gemini 2.0 Flash",
          "apiModelId": "gemini-2.0-flash"
        },
        {
          "id": "model-discovered-15b029fc02435f4e7373",
          "name": "Gemini 2.0 Flash-Lite",
          "apiModelId": "gemini-2.0-flash-lite"
        },
        {
          "id": "model-discovered-bd4c8bf27af648d3330a",
          "name": "Gemini 2.5 Flash",
          "apiModelId": "gemini-2.5-flash"
        },
        {
          "id": "model-discovered-4f4b5da7ada2d9de5083",
          "name": "Gemini 2.5 Flash Live",
          "apiModelId": "gemini-2.5-flash-native-audio-preview-12-2025"
        },
        {
          "id": "model-discovered-2157bb2b07e6a87cc2a8",
          "name": "Gemini 2.5 Flash TTS",
          "apiModelId": "gemini-2.5-flash-preview-tts"
        },
        {
          "id": "model-discovered-8117798ae58404fd4297",
          "name": "Gemini 2.5 Flash-Lite",
          "apiModelId": "gemini-2.5-flash-lite"
        },
        {
          "id": "model-discovered-b41c55e3ff71ff33d32b",
          "name": "Gemini 2.5 Pro",
          "apiModelId": "gemini-2.5-pro"
        },
        {
          "id": "model-discovered-f76d13c3ede266d7e1e4",
          "name": "Gemini 2.5 Pro TTS",
          "apiModelId": "gemini-2.5-pro-preview-tts"
        },
        {
          "id": "model-discovered-fc973b7c5cd91319493b",
          "name": "Gemini 3 Flash",
          "apiModelId": "gemini-3-flash-preview"
        },
        {
          "id": "model-discovered-bba8e7fdaaa5feb26728",
          "name": "Gemini 3 Pro Preview",
          "apiModelId": "gemini-3-pro-preview"
        },
        {
          "id": "model-discovered-cb00673f4eb5f1b0f47c",
          "name": "Gemini 3.1 Flash Live",
          "apiModelId": "gemini-3.1-flash-live-preview"
        },
        {
          "id": "model-discovered-e286634f954d5e40b670",
          "name": "Gemini 3.1 Flash TTS",
          "apiModelId": "gemini-3.1-flash-tts-preview"
        },
        {
          "id": "model-discovered-8ab5c52cb1cd5cf88e26",
          "name": "Gemini 3.1 Flash-Lite",
          "apiModelId": "gemini-3.1-flash-lite"
        },
        {
          "id": "model-discovered-4882e78c90fbf11b8297",
          "name": "Gemini 3.1 Flash-Lite Preview",
          "apiModelId": "gemini-3.1-flash-lite-preview"
        },
        {
          "id": "model-discovered-fd0c815a6942fe9646f0",
          "name": "Gemini 3.1 Pro",
          "apiModelId": "gemini-3.1-pro-preview"
        },
        {
          "id": "model-discovered-f29bc63c04163f5b021c",
          "name": "Gemini 3.5 Flash",
          "apiModelId": "gemini-3.5-flash"
        },
        {
          "id": "model-discovered-8cd3db89db51e350e528",
          "name": "Gemini 3.5 Flash-Lite",
          "apiModelId": "gemini-3.5-flash-lite"
        },
        {
          "id": "model-discovered-4c46e3ea2ea387fc6782",
          "name": "Gemini 3.5 Live Translate",
          "apiModelId": "gemini-3.5-live-translate-preview"
        },
        {
          "id": "model-discovered-85d1ba853a1ef46be5bd",
          "name": "Gemini 3.6 Flash",
          "apiModelId": "gemini-3.6-flash"
        },
        {
          "id": "model-discovered-f3ee403332f490da7638",
          "name": "Gemini 3.7 Flash",
          "apiModelId": "gemini-3.7-flash"
        },
        {
          "id": "model-gemini-3-8-flash",
          "name": "Gemini 3.8 Flash",
          "apiModelId": "gemini-3.8-flash"
        },
        {
          "id": "model-discovered-162b802bf1fd8a44b140",
          "name": "Gemini 3.8 Flash TTS",
          "apiModelId": "gemini-3.8-flash-tts"
        },
        {
          "id": "model-discovered-2137010c24fecd404af3",
          "name": "Gemini 3.8 Flash-Lite TTS",
          "apiModelId": "gemini-3.8-flash-lite-tts"
        },
        {
          "id": "model-discovered-8c0284c5ebb6ab9da7f4",
          "name": "Gemini 3.8 Live",
          "apiModelId": "gemini-3.8-live"
        },
        {
          "id": "model-discovered-13f5d8898f66c01922e3",
          "name": "Gemini 3.8 Live Extended Thinking",
          "apiModelId": "gemini-3.8-live-extended-thinking"
        },
        {
          "id": "model-discovered-1de9ab9ffbd3b35989f7",
          "name": "Gemini 4 Argon",
          "apiModelId": "gemini-4-argon"
        },
        {
          "id": "model-discovered-e4cad8ba5d5bc779408a",
          "name": "Gemini Embedding",
          "apiModelId": "gemini-embedding-001"
        },
        {
          "id": "model-discovered-7bdbf966c27ba583d26a",
          "name": "Gemini Embedding 2",
          "apiModelId": "gemini-embedding-2-preview"
        },
        {
          "id": "model-discovered-ac152d2e8d24eb4c3232",
          "name": "Gemini Omni Flash",
          "apiModelId": "gemini-omni-1.1-flash"
        },
        {
          "id": "model-discovered-3c31be2eeda4bcd851d7",
          "name": "Gemini Robotics ER 1.6",
          "apiModelId": "gemini-robotics-er-1.6-preview"
        },
        {
          "id": "model-discovered-468b94523288b17c49bd",
          "name": "Gemini Robotics ER 2",
          "apiModelId": "gemini-robotics-er-2-preview"
        },
        {
          "id": "model-discovered-6a9ccf4ad79b1e8dd304",
          "name": "Nano Banana",
          "apiModelId": "gemini-2.5-flash-image"
        },
        {
          "id": "model-discovered-59f0f72683377111d7bc",
          "name": "Nano Banana 2",
          "apiModelId": "gemini-3.1-flash-image"
        },
        {
          "id": "model-discovered-ee0a631bc7a1c2147ca6",
          "name": "Nano Banana 2 Lite",
          "apiModelId": "gemini-3.1-flash-lite-image"
        },
        {
          "id": "model-discovered-5b7bfd3b88fda1402744",
          "name": "Nano Banana 2.1",
          "apiModelId": "gemini-nano-banana-2.1"
        },
        {
          "id": "model-discovered-5f80092f5e85cef40c36",
          "name": "Nano Banana Pro",
          "apiModelId": "gemini-3-pro-image"
        }
      ]
    },
    {
      "id": "vendor-independent-research",
      "name": "Independent research",
      "models": []
    },
    {
      "id": "vendor-openai",
      "name": "OpenAI",
      "models": [
        {
          "id": "model-discovered-1140963289b9cebf9fe9",
          "name": "ChatGPT-4o Model",
          "apiModelId": "chatgpt-4o-latest"
        },
        {
          "id": "model-discovered-1b05544a1e38815ba050",
          "name": "chatgpt-image-latest",
          "apiModelId": "chatgpt-image-latest"
        },
        {
          "id": "model-discovered-43e4ff83a595f03273e8",
          "name": "codex-mini-latest",
          "apiModelId": "codex-mini-latest"
        },
        {
          "id": "model-discovered-6a30c69a24a2ba7616e7",
          "name": "Daybreak Blue",
          "apiModelId": "gpt-daybreak-blue-latest"
        },
        {
          "id": "model-discovered-01433a49c5cc60e7428c",
          "name": "Daybreak Red",
          "apiModelId": "gpt-daybreak-red-latest"
        },
        {
          "id": "model-discovered-c221dc89c0adc7bf58c9",
          "name": "GPT-3.5 Turbo",
          "apiModelId": "gpt-3.5-turbo"
        },
        {
          "id": "model-discovered-731392d07973ec4dd374",
          "name": "GPT-4",
          "apiModelId": "gpt-4"
        },
        {
          "id": "model-discovered-d59d6ddd57ee9a1e8d3f",
          "name": "GPT-4 Turbo",
          "apiModelId": "gpt-4-turbo"
        },
        {
          "id": "model-discovered-ee7fbd4ea5b036d8c4d8",
          "name": "GPT-4 Turbo Preview",
          "apiModelId": "gpt-4-turbo-preview"
        },
        {
          "id": "model-discovered-e7ad5bd7e714b6fbe0c3",
          "name": "GPT-4.1",
          "apiModelId": "gpt-4.1"
        },
        {
          "id": "model-discovered-b9257ac7a2c8eaca2b5a",
          "name": "GPT-4.1 Mini",
          "apiModelId": "gpt-4.1-mini"
        },
        {
          "id": "model-discovered-b422818c6300cfc29362",
          "name": "GPT-4.1 nano",
          "apiModelId": "gpt-4.1-nano"
        },
        {
          "id": "model-discovered-b9917ad913a137839464",
          "name": "GPT-4.5 Preview",
          "apiModelId": "gpt-4.5-preview"